{
  "schema_version": "1.0",
  "model": { "name": "gpt-5.0", "version": "2025-10-01" },
  "timestamp_utc": "2025-10-23T12:00:00Z",
  "locale": "en-GB",
  "prompt_fingerprint": "b2f0c52f-7e9d-42e1-9c5b-3e5c9b1b4b44",
  "metrics": {
    "cluster_size": 100,
    "mean_visibility": 0.62,
    "std_dev": 0.04,
    "ci95": 0.03,
    "cv": 0.0645,
    "icc": 0.82
  },
  "sampling": {
    "categories": ["intent","conversational"],
    "regions": ["UK","DE","FR"]
  },
  "evidence_hash": "optional-sha256"
}
